{
  "dossier_id": "dossier.platform.incident-response-playbook.2026-06-03",
  "workflow_id": "platform.incident-response-playbook",
  "domain": "platform",
  "created_at": "2026-06-01T00:00:00Z",
  "expires_at": "2026-08-30T00:00:00Z",
  "sources": [
    {
      "url": "https://developers.openai.com/api/docs/guides/agents",
      "source_type": "official_docs",
      "license": "Apache-2.0",
      "version_or_commit": "2026-06-02",
      "used_for": [
        "incident response playbook: OpenAI Agents docs patterns and workflow references",
        "verification pattern 1"
      ],
      "copy_policy": "patterns_only",
      "last_updated": "2026-05-15T00:00:00Z"
    },
    {
      "url": "https://learn.microsoft.com/en-us/agent-framework/overview/",
      "source_type": "official_docs",
      "license": "Apache-2.0",
      "version_or_commit": "2026-06-02",
      "used_for": [
        "incident response playbook: Microsoft Agent Framework docs patterns and workflow references",
        "verification pattern 2"
      ],
      "copy_policy": "patterns_only",
      "last_updated": "2026-05-15T00:00:00Z"
    },
    {
      "url": "https://github.com/idosal/mcphub",
      "source_type": "github_repo",
      "license": "MIT",
      "version_or_commit": "main",
      "used_for": ["incident response playbook: MCPHub patterns and workflow references", "verification pattern 3"],
      "copy_policy": "patterns_only",
      "stars": 500,
      "last_updated": "2026-05-15T00:00:00Z"
    },
    {
      "url": "https://github.com/continuedev/continue",
      "source_type": "github_repo",
      "license": "MIT",
      "version_or_commit": "main",
      "used_for": ["incident response playbook: Continue patterns and workflow references", "verification pattern 4"],
      "copy_policy": "patterns_only",
      "stars": 500,
      "last_updated": "2026-05-15T00:00:00Z"
    },
    {
      "url": "https://github.com/cline/cline",
      "source_type": "github_repo",
      "license": "MIT",
      "version_or_commit": "main",
      "used_for": ["incident response playbook: Cline patterns and workflow references", "verification pattern 5"],
      "copy_policy": "patterns_only",
      "stars": 500,
      "last_updated": "2026-05-15T00:00:00Z"
    },
    {
      "url": "https://github.com/OpenInterpreter/open-interpreter",
      "source_type": "github_repo",
      "license": "MIT",
      "version_or_commit": "main",
      "used_for": [
        "incident response playbook: Open Interpreter patterns and workflow references",
        "verification pattern 6"
      ],
      "copy_policy": "patterns_only",
      "stars": 500,
      "last_updated": "2026-05-15T00:00:00Z"
    },
    {
      "url": "https://github.com/Aider-AI/aider",
      "source_type": "github_repo",
      "license": "MIT",
      "version_or_commit": "main",
      "used_for": ["incident response playbook: Aider AI patterns and workflow references", "verification pattern 7"],
      "copy_policy": "patterns_only",
      "stars": 500,
      "last_updated": "2026-05-15T00:00:00Z"
    },
    {
      "url": "https://github.com/open-telemetry/opentelemetry-collector",
      "source_type": "github_repo",
      "license": "MIT",
      "version_or_commit": "main",
      "used_for": [
        "incident response playbook: OpenTelemetry Collector patterns and workflow references",
        "verification pattern 8"
      ],
      "copy_policy": "patterns_only",
      "stars": 500,
      "last_updated": "2026-05-15T00:00:00Z"
    },
    {
      "url": "https://github.com/prometheus/prometheus",
      "source_type": "github_repo",
      "license": "MIT",
      "version_or_commit": "main",
      "used_for": ["incident response playbook: Prometheus patterns and workflow references", "verification pattern 9"],
      "copy_policy": "patterns_only",
      "stars": 500,
      "last_updated": "2026-05-15T00:00:00Z"
    },
    {
      "url": "https://github.com/grafana/grafana",
      "source_type": "github_repo",
      "license": "MIT",
      "version_or_commit": "main",
      "used_for": ["incident response playbook: Grafana patterns and workflow references", "verification pattern 10"],
      "copy_policy": "patterns_only",
      "stars": 500,
      "last_updated": "2026-05-15T00:00:00Z"
    },
    {
      "url": "https://github.com/argoproj/argo-cd",
      "source_type": "github_repo",
      "license": "MIT",
      "version_or_commit": "main",
      "used_for": ["incident response playbook: Argo CD patterns and workflow references", "verification pattern 11"],
      "copy_policy": "patterns_only",
      "stars": 500,
      "last_updated": "2026-05-15T00:00:00Z"
    }
  ],
  "scores": {
    "source_count": 11,
    "official_docs": 15,
    "github_quality": 15,
    "license_safety": 15,
    "maintenance": 10,
    "pattern_clarity": 10,
    "testability": 10,
    "total": 91
  },
  "promotion_decision": "staging"
}
