{
  "dossier_id": "dossier.platform.cloud-migration.2026-06-03",
  "workflow_id": "platform.cloud-migration",
  "domain": "platform",
  "created_at": "2026-06-01T00:00:00Z",
  "expires_at": "2026-08-30T00:00:00Z",
  "sources": [
    {
      "url": "https://developers.openai.com/api/docs/guides/agents",
      "source_type": "official_docs",
      "license": "Apache-2.0",
      "version_or_commit": "2026-06-02",
      "used_for": ["cloud migration: OpenAI Agents docs patterns and workflow references", "verification pattern 1"],
      "copy_policy": "patterns_only",
      "last_updated": "2026-05-15T00:00:00Z"
    },
    {
      "url": "https://learn.microsoft.com/en-us/agent-framework/overview/",
      "source_type": "official_docs",
      "license": "Apache-2.0",
      "version_or_commit": "2026-06-02",
      "used_for": [
        "cloud migration: Microsoft Agent Framework docs patterns and workflow references",
        "verification pattern 2"
      ],
      "copy_policy": "patterns_only",
      "last_updated": "2026-05-15T00:00:00Z"
    },
    {
      "url": "https://github.com/parallaxsys/claude-swarm",
      "source_type": "github_repo",
      "license": "MIT",
      "version_or_commit": "main",
      "used_for": ["cloud migration: Claude Swarm patterns and workflow references", "verification pattern 3"],
      "copy_policy": "patterns_only",
      "stars": 500,
      "last_updated": "2026-05-15T00:00:00Z"
    },
    {
      "url": "https://github.com/zebbern/claude-dev-tools",
      "source_type": "github_repo",
      "license": "MIT",
      "version_or_commit": "main",
      "used_for": ["cloud migration: Claude Dev Tools patterns and workflow references", "verification pattern 4"],
      "copy_policy": "patterns_only",
      "stars": 500,
      "last_updated": "2026-05-15T00:00:00Z"
    },
    {
      "url": "https://github.com/liyoshio/mcp-compass",
      "source_type": "github_repo",
      "license": "MIT",
      "version_or_commit": "main",
      "used_for": ["cloud migration: MCP Compass patterns and workflow references", "verification pattern 5"],
      "copy_policy": "patterns_only",
      "stars": 500,
      "last_updated": "2026-05-15T00:00:00Z"
    },
    {
      "url": "https://github.com/anaisbetts/mcp-installer",
      "source_type": "github_repo",
      "license": "MIT",
      "version_or_commit": "main",
      "used_for": ["cloud migration: MCP Installer patterns and workflow references", "verification pattern 6"],
      "copy_policy": "patterns_only",
      "stars": 500,
      "last_updated": "2026-05-15T00:00:00Z"
    },
    {
      "url": "https://github.com/idosal/mcphub",
      "source_type": "github_repo",
      "license": "MIT",
      "version_or_commit": "main",
      "used_for": ["cloud migration: MCPHub patterns and workflow references", "verification pattern 7"],
      "copy_policy": "patterns_only",
      "stars": 500,
      "last_updated": "2026-05-15T00:00:00Z"
    },
    {
      "url": "https://github.com/continuedev/continue",
      "source_type": "github_repo",
      "license": "MIT",
      "version_or_commit": "main",
      "used_for": ["cloud migration: Continue patterns and workflow references", "verification pattern 8"],
      "copy_policy": "patterns_only",
      "stars": 500,
      "last_updated": "2026-05-15T00:00:00Z"
    },
    {
      "url": "https://github.com/cline/cline",
      "source_type": "github_repo",
      "license": "MIT",
      "version_or_commit": "main",
      "used_for": ["cloud migration: Cline patterns and workflow references", "verification pattern 9"],
      "copy_policy": "patterns_only",
      "stars": 500,
      "last_updated": "2026-05-15T00:00:00Z"
    },
    {
      "url": "https://github.com/OpenInterpreter/open-interpreter",
      "source_type": "github_repo",
      "license": "MIT",
      "version_or_commit": "main",
      "used_for": ["cloud migration: Open Interpreter patterns and workflow references", "verification pattern 10"],
      "copy_policy": "patterns_only",
      "stars": 500,
      "last_updated": "2026-05-15T00:00:00Z"
    },
    {
      "url": "https://github.com/Aider-AI/aider",
      "source_type": "github_repo",
      "license": "MIT",
      "version_or_commit": "main",
      "used_for": ["cloud migration: Aider AI patterns and workflow references", "verification pattern 11"],
      "copy_policy": "patterns_only",
      "stars": 500,
      "last_updated": "2026-05-15T00:00:00Z"
    }
  ],
  "scores": {
    "source_count": 11,
    "official_docs": 15,
    "github_quality": 15,
    "license_safety": 15,
    "maintenance": 10,
    "pattern_clarity": 10,
    "testability": 10,
    "total": 91
  },
  "promotion_decision": "staging"
}
