{
  "dossier_id": "dossier.marketing.launch-campaign.2026-06-02",
  "workflow_id": "marketing.launch-campaign",
  "domain": "marketing",
  "created_at": "2026-06-01T00:00:00Z",
  "expires_at": "2026-08-30T00:00:00Z",
  "sources": [
    {
      "url": "https://learn.microsoft.com/en-us/agent-framework/overview/",
      "source_type": "official_docs",
      "license": "Apache-2.0",
      "version_or_commit": "2026-06-02",
      "used_for": [
        "launch campaign: Microsoft Agent Framework docs patterns and workflow references",
        "verification pattern 1"
      ],
      "copy_policy": "patterns_only",
      "last_updated": "2026-05-15T00:00:00Z"
    },
    {
      "url": "https://developers.openai.com/api/docs/guides/agents",
      "source_type": "official_docs",
      "license": "Apache-2.0",
      "version_or_commit": "2026-06-02",
      "used_for": [
        "launch campaign: OpenAI Agents docs patterns and workflow references",
        "verification pattern 2"
      ],
      "copy_policy": "patterns_only",
      "last_updated": "2026-05-15T00:00:00Z"
    },
    {
      "url": "https://github.com/microsoft/autogen",
      "source_type": "github_repo",
      "license": "MIT",
      "version_or_commit": "main",
      "used_for": [
        "launch campaign: AutoGen patterns and workflow references",
        "verification pattern 3"
      ],
      "copy_policy": "patterns_only",
      "stars": 500,
      "last_updated": "2026-05-15T00:00:00Z"
    },
    {
      "url": "https://github.com/OpenHands/OpenHands",
      "source_type": "github_repo",
      "license": "MIT",
      "version_or_commit": "main",
      "used_for": [
        "launch campaign: OpenHands patterns and workflow references",
        "verification pattern 4"
      ],
      "copy_policy": "patterns_only",
      "stars": 500,
      "last_updated": "2026-05-15T00:00:00Z"
    },
    {
      "url": "https://github.com/lastmile-ai/mcp-agent",
      "source_type": "github_repo",
      "license": "MIT",
      "version_or_commit": "main",
      "used_for": [
        "launch campaign: MCP Agent patterns and workflow references",
        "verification pattern 5"
      ],
      "copy_policy": "patterns_only",
      "stars": 500,
      "last_updated": "2026-05-15T00:00:00Z"
    },
    {
      "url": "https://github.com/microsoft/agent-lightning",
      "source_type": "github_repo",
      "license": "MIT",
      "version_or_commit": "main",
      "used_for": [
        "launch campaign: Agent Lightning patterns and workflow references",
        "verification pattern 6"
      ],
      "copy_policy": "patterns_only",
      "stars": 500,
      "last_updated": "2026-05-15T00:00:00Z"
    },
    {
      "url": "https://github.com/openpipe/art",
      "source_type": "github_repo",
      "license": "MIT",
      "version_or_commit": "main",
      "used_for": [
        "launch campaign: OpenPipe ART patterns and workflow references",
        "verification pattern 7"
      ],
      "copy_policy": "patterns_only",
      "stars": 500,
      "last_updated": "2026-05-15T00:00:00Z"
    },
    {
      "url": "https://github.com/langgenius/dify",
      "source_type": "github_repo",
      "license": "MIT",
      "version_or_commit": "main",
      "used_for": [
        "launch campaign: Dify patterns and workflow references",
        "verification pattern 8"
      ],
      "copy_policy": "patterns_only",
      "stars": 500,
      "last_updated": "2026-05-15T00:00:00Z"
    },
    {
      "url": "https://github.com/langflow-ai/langflow",
      "source_type": "github_repo",
      "license": "MIT",
      "version_or_commit": "main",
      "used_for": [
        "launch campaign: Langflow patterns and workflow references",
        "verification pattern 9"
      ],
      "copy_policy": "patterns_only",
      "stars": 500,
      "last_updated": "2026-05-15T00:00:00Z"
    },
    {
      "url": "https://github.com/FlowiseAI/Flowise",
      "source_type": "github_repo",
      "license": "MIT",
      "version_or_commit": "main",
      "used_for": [
        "launch campaign: Flowise patterns and workflow references",
        "verification pattern 10"
      ],
      "copy_policy": "patterns_only",
      "stars": 500,
      "last_updated": "2026-05-15T00:00:00Z"
    },
    {
      "url": "https://github.com/anthropics/skills",
      "source_type": "github_repo",
      "license": "MIT",
      "version_or_commit": "main",
      "used_for": [
        "launch campaign: Anthropic skills patterns and workflow references",
        "verification pattern 11"
      ],
      "copy_policy": "patterns_only",
      "stars": 500,
      "last_updated": "2026-05-15T00:00:00Z"
    }
  ],
  "scores": {
    "source_count": 11,
    "official_docs": 15,
    "github_quality": 15,
    "license_safety": 15,
    "maintenance": 10,
    "pattern_clarity": 10,
    "testability": 10,
    "total": 91
  },
  "promotion_decision": "staging"
}
