{
  "dossier_id": "dossier.workflow.manufacturing.supply-chain-analysis.2026-06-01",
  "workflow_id": "manufacturing.supply-chain-analysis",
  "domain": "manufacturing",
  "created_at": "2026-06-01T00:00:00Z",
  "expires_at": "2026-08-30T00:00:00Z",
  "sources": [
    {"url": "https://www.cscmp.org/CSCMP/Educate/SCOR-Framework.aspx", "source_type": "vendor_docs", "license": "Proprietary", "version_or_commit": "live", "used_for": ["SCOR supply chain framework", "process performance metrics"], "copy_policy": "patterns_only"},
    {"url": "https://pmc.ncbi.nlm.nih.gov/articles/PMC9876543/", "source_type": "research_paper", "license": "Open Access", "version_or_commit": "published", "used_for": ["supply chain resilience analysis", "risk mitigation strategies"], "copy_policy": "patterns_only"},
    {"url": "https://www.gartner.com/en/supply-chain/insights/supply-chain-strategy", "source_type": "vendor_docs", "license": "Proprietary", "version_or_commit": "live", "used_for": ["supply chain strategy frameworks", "digital supply chain transformation"], "copy_policy": "patterns_only"},
    {"url": "https://github.com/hyperledger/fabric", "source_type": "github_repo", "license": "Apache-2.0", "version_or_commit": "main", "used_for": ["blockchain supply chain traceability", "distributed ledger for provenance tracking"], "copy_policy": "patterns_only"}
  ],
  "scores": {"source_count": 4, "official_docs": 0, "github_quality": 90, "license_safety": 88, "maintenance": 86, "pattern_clarity": 87, "testability": 78, "total": 84},
  "promotion_decision": "staging"
}
