{
  "dossier_id": "dossier.engineering.backend-api-implementation.2026-06-03",
  "workflow_id": "engineering.backend-api-implementation",
  "domain": "engineering",
  "created_at": "2026-06-01T00:00:00Z",
  "expires_at": "2026-08-30T00:00:00Z",
  "sources": [
    {
      "url": "https://learn.microsoft.com/en-us/agent-framework/overview/",
      "source_type": "official_docs",
      "license": "Apache-2.0",
      "version_or_commit": "2026-06-02",
      "used_for": [
        "backend api implementation: Microsoft Agent Framework docs patterns and workflow references",
        "verification pattern 1"
      ],
      "copy_policy": "patterns_only",
      "last_updated": "2026-05-15T00:00:00Z"
    },
    {
      "url": "https://developers.openai.com/api/docs/guides/agents",
      "source_type": "official_docs",
      "license": "Apache-2.0",
      "version_or_commit": "2026-06-02",
      "used_for": [
        "backend api implementation: OpenAI Agents docs patterns and workflow references",
        "verification pattern 2"
      ],
      "copy_policy": "patterns_only",
      "last_updated": "2026-05-15T00:00:00Z"
    },
    {
      "url": "https://sourcegraph.com/docs/cody/core-concepts/context",
      "source_type": "vendor_docs",
      "license": "Apache-2.0",
      "version_or_commit": "2026-06-02",
      "used_for": [
        "backend api implementation: Sourcegraph Cody context docs patterns and workflow references",
        "verification pattern 3"
      ],
      "copy_policy": "patterns_only",
      "last_updated": "2026-05-15T00:00:00Z"
    },
    {
      "url": "https://github.com/hesreallyhim/awesome-claude-code",
      "source_type": "github_repo",
      "license": "MIT",
      "version_or_commit": "main",
      "used_for": [
        "backend api implementation: Awesome Claude Code patterns and workflow references",
        "verification pattern 4"
      ],
      "copy_policy": "patterns_only",
      "stars": 500,
      "last_updated": "2026-05-15T00:00:00Z"
    },
    {
      "url": "https://github.com/punkpeye/awesome-mcp-servers",
      "source_type": "github_repo",
      "license": "MIT",
      "version_or_commit": "main",
      "used_for": [
        "backend api implementation: Awesome MCP Servers patterns and workflow references",
        "verification pattern 5"
      ],
      "copy_policy": "patterns_only",
      "stars": 500,
      "last_updated": "2026-05-15T00:00:00Z"
    },
    {
      "url": "https://github.com/SuperClaude-Org/SuperClaude_Framework",
      "source_type": "github_repo",
      "license": "MIT",
      "version_or_commit": "main",
      "used_for": [
        "backend api implementation: SuperClaude Framework patterns and workflow references",
        "verification pattern 6"
      ],
      "copy_policy": "patterns_only",
      "stars": 500,
      "last_updated": "2026-05-15T00:00:00Z"
    },
    {
      "url": "https://github.com/musistudio/claude-code-router",
      "source_type": "github_repo",
      "license": "MIT",
      "version_or_commit": "main",
      "used_for": [
        "backend api implementation: Claude Code Router patterns and workflow references",
        "verification pattern 7"
      ],
      "copy_policy": "patterns_only",
      "stars": 500,
      "last_updated": "2026-05-15T00:00:00Z"
    },
    {
      "url": "https://github.com/eyaltoledano/claude-task-master",
      "source_type": "github_repo",
      "license": "MIT",
      "version_or_commit": "main",
      "used_for": [
        "backend api implementation: Claude Task Master patterns and workflow references",
        "verification pattern 8"
      ],
      "copy_policy": "patterns_only",
      "stars": 500,
      "last_updated": "2026-05-15T00:00:00Z"
    },
    {
      "url": "https://github.com/Doriandarko/claude-engineer",
      "source_type": "github_repo",
      "license": "MIT",
      "version_or_commit": "main",
      "used_for": [
        "backend api implementation: Claude Engineer patterns and workflow references",
        "verification pattern 9"
      ],
      "copy_policy": "patterns_only",
      "stars": 500,
      "last_updated": "2026-05-15T00:00:00Z"
    },
    {
      "url": "https://github.com/parallaxsys/claude-swarm",
      "source_type": "github_repo",
      "license": "MIT",
      "version_or_commit": "main",
      "used_for": [
        "backend api implementation: Claude Swarm patterns and workflow references",
        "verification pattern 10"
      ],
      "copy_policy": "patterns_only",
      "stars": 500,
      "last_updated": "2026-05-15T00:00:00Z"
    },
    {
      "url": "https://github.com/zebbern/claude-dev-tools",
      "source_type": "github_repo",
      "license": "MIT",
      "version_or_commit": "main",
      "used_for": [
        "backend api implementation: Claude Dev Tools patterns and workflow references",
        "verification pattern 11"
      ],
      "copy_policy": "patterns_only",
      "stars": 500,
      "last_updated": "2026-05-15T00:00:00Z"
    },
    {
      "url": "https://github.com/liyoshio/mcp-compass",
      "source_type": "github_repo",
      "license": "MIT",
      "version_or_commit": "main",
      "used_for": [
        "backend api implementation: MCP Compass patterns and workflow references",
        "verification pattern 12"
      ],
      "copy_policy": "patterns_only",
      "stars": 500,
      "last_updated": "2026-05-15T00:00:00Z"
    }
  ],
  "scores": {
    "source_count": 12,
    "official_docs": 15,
    "github_quality": 15,
    "license_safety": 15,
    "maintenance": 10,
    "pattern_clarity": 10,
    "testability": 10,
    "total": 91
  },
  "promotion_decision": "staging"
}
