{
  "dossier_id": "dossier.product-business.product-launch.2026-06-03",
  "workflow_id": "product-business.product-launch",
  "domain": "product-business",
  "created_at": "2026-05-31T00:00:00Z",
  "expires_at": "2026-08-30T00:00:00Z",
  "sources": [
    {
      "url": "https://developers.openai.com/api/docs/guides/agents",
      "source_type": "official_docs",
      "license": "Apache-2.0",
      "version_or_commit": "2026-06-02",
      "used_for": ["product launch: OpenAI Agents docs patterns and workflow references", "verification pattern 1"],
      "copy_policy": "patterns_only",
      "last_updated": "2026-05-15T00:00:00Z"
    },
    {
      "url": "https://learn.microsoft.com/en-us/agent-framework/overview/",
      "source_type": "official_docs",
      "license": "Apache-2.0",
      "version_or_commit": "2026-06-02",
      "used_for": [
        "product launch: Microsoft Agent Framework docs patterns and workflow references",
        "verification pattern 2"
      ],
      "copy_policy": "patterns_only",
      "last_updated": "2026-05-15T00:00:00Z"
    },
    {
      "url": "https://github.com/microsoft/agent-lightning",
      "source_type": "github_repo",
      "license": "MIT",
      "version_or_commit": "main",
      "used_for": ["product launch: Agent Lightning patterns and workflow references", "verification pattern 3"],
      "copy_policy": "patterns_only",
      "stars": 500,
      "last_updated": "2026-05-15T00:00:00Z"
    },
    {
      "url": "https://github.com/openpipe/art",
      "source_type": "github_repo",
      "license": "MIT",
      "version_or_commit": "main",
      "used_for": ["product launch: OpenPipe ART patterns and workflow references", "verification pattern 4"],
      "copy_policy": "patterns_only",
      "stars": 500,
      "last_updated": "2026-05-15T00:00:00Z"
    },
    {
      "url": "https://github.com/langgenius/dify",
      "source_type": "github_repo",
      "license": "MIT",
      "version_or_commit": "main",
      "used_for": ["product launch: Dify patterns and workflow references", "verification pattern 5"],
      "copy_policy": "patterns_only",
      "stars": 500,
      "last_updated": "2026-05-15T00:00:00Z"
    },
    {
      "url": "https://github.com/langflow-ai/langflow",
      "source_type": "github_repo",
      "license": "MIT",
      "version_or_commit": "main",
      "used_for": ["product launch: Langflow patterns and workflow references", "verification pattern 6"],
      "copy_policy": "patterns_only",
      "stars": 500,
      "last_updated": "2026-05-15T00:00:00Z"
    },
    {
      "url": "https://github.com/FlowiseAI/Flowise",
      "source_type": "github_repo",
      "license": "MIT",
      "version_or_commit": "main",
      "used_for": ["product launch: Flowise patterns and workflow references", "verification pattern 7"],
      "copy_policy": "patterns_only",
      "stars": 500,
      "last_updated": "2026-05-15T00:00:00Z"
    },
    {
      "url": "https://github.com/anthropics/skills",
      "source_type": "github_repo",
      "license": "MIT",
      "version_or_commit": "main",
      "used_for": ["product launch: Anthropic skills patterns and workflow references", "verification pattern 8"],
      "copy_policy": "patterns_only",
      "stars": 500,
      "last_updated": "2026-05-15T00:00:00Z"
    },
    {
      "url": "https://github.com/VoltAgent/awesome-claude-skills",
      "source_type": "github_repo",
      "license": "MIT",
      "version_or_commit": "main",
      "used_for": ["product launch: Awesome Agent Skills patterns and workflow references", "verification pattern 9"],
      "copy_policy": "patterns_only",
      "stars": 500,
      "last_updated": "2026-05-15T00:00:00Z"
    },
    {
      "url": "https://github.com/kyrolabs/awesome-agents",
      "source_type": "github_repo",
      "license": "MIT",
      "version_or_commit": "main",
      "used_for": ["product launch: Awesome Agents patterns and workflow references", "verification pattern 10"],
      "copy_policy": "patterns_only",
      "stars": 500,
      "last_updated": "2026-05-15T00:00:00Z"
    },
    {
      "url": "https://github.com/vivy-yi/awesome-agent-orchestration",
      "source_type": "github_repo",
      "license": "MIT",
      "version_or_commit": "main",
      "used_for": [
        "product launch: Awesome Agent Orchestration patterns and workflow references",
        "verification pattern 11"
      ],
      "copy_policy": "patterns_only",
      "stars": 500,
      "last_updated": "2026-05-15T00:00:00Z"
    }
  ],
  "scores": {
    "source_count": 11,
    "official_docs": 15,
    "github_quality": 15,
    "license_safety": 15,
    "maintenance": 10,
    "pattern_clarity": 10,
    "testability": 10,
    "total": 91
  },
  "promotion_decision": "staging"
}
