{
  "dossier_id": "dossier.workflow.product-business.product-discovery.2026-05-31",
  "workflow_id": "product-business.product-discovery",
  "domain": "product-business",
  "created_at": "2026-05-31T00:00:00Z",
  "expires_at": "2026-08-30T00:00:00Z",
  "sources": [
    {
      "url": "https://www.svpg.com/inspired-how-to-create-products-customers-love/",
      "source_type": "official_docs",
      "license": "Proprietary",
      "version_or_commit": "live",
      "used_for": [
        "product discovery cycle and opportunity validation"
      ],
      "copy_policy": "patterns_only"
    },
    {
      "url": "https://github.com/PostHog/posthog",
      "source_type": "github_repo",
      "license": "MIT",
      "version_or_commit": "master",
      "used_for": [
        "product discovery cycle and opportunity validation"
      ],
      "copy_policy": "patterns_only"
    },
    {
      "url": "https://www.nngroup.com/articles/discovery-phase/",
      "source_type": "official_docs",
      "license": "Proprietary",
      "version_or_commit": "live",
      "used_for": [
        "product discovery cycle and opportunity validation"
      ],
      "copy_policy": "patterns_only"
    }
  ],
  "scores": {
    "source_count": 3,
    "official_docs": 2,
    "github_quality": 90,
    "license_safety": 88,
    "maintenance": 86,
    "pattern_clarity": 87,
    "testability": 82,
    "total": 90
  },
  "promotion_decision": "staging"
}