{
  "dossier_id": "dossier.workflow.design-content.accessibility-audit.2026-05-31",
  "workflow_id": "design-content.accessibility-audit",
  "domain": "design-content",
  "created_at": "2026-05-31T00:00:00Z",
  "expires_at": "2026-08-30T00:00:00Z",
  "sources": [
    {"url": "https://www.w3.org/WAI/standards-guidelines/wcag/", "source_type": "official_docs", "license": "W3C Document License", "version_or_commit": "WCAG 2.2", "used_for": ["WCAG 2.2 audit criteria"], "copy_policy": "patterns_only"},
    {"url": "https://www.w3.org/WAI/ARIA/apg/", "source_type": "official_docs", "license": "W3C Document License", "version_or_commit": "1.2", "used_for": ["ARIA authoring practices"], "copy_policy": "patterns_only"},
    {"url": "https://dequeuniversity.com/", "source_type": "vendor_docs", "license": "Proprietary", "version_or_commit": "2024", "used_for": ["axe-core audit methodology"], "copy_policy": "patterns_only"}
  ],
  "scores": {"source_count": 3, "official_docs": 2, "github_quality": 82, "license_safety": 94, "maintenance": 94, "pattern_clarity": 95, "testability": 92, "total": 92},
  "promotion_decision": "staging"
}
